{
  "schema": "upready.theme-preset/v0",
  "id": "womens-fashion",
  "label": "Larchant",
  "description": "Larchant, the women's clothing profile: warm cream paper, ink black type, and one clay red that only ever means 'this is the one' — sale price, link, focus ring, selected swatch. --radius 0.125rem, the corner of a pressed card, because an editorial page has no rounded chrome. Light is the default mode and the mode the brand was drawn in; dark is a full second palette warmed to the same cream, not an inversion. Values are section 3 of the profile's design/style-board.md; the contrast table is section 3.3, computed by design/contrast.mjs.",
  "dictionary": "geist-kit/theme.css",
  "source": "apps/backend/src/migration-scripts/data/profiles/womens-fashion/design/style-board.md section 3 (store-profiles wave 2, W1/W4)",
  "modes": {
    "light": {
      "tokens": {
        "--radius": "0.125rem",
        "--background": "#f7f2e9",
        "--foreground": "#17140f",
        "--card": "#fdfaf4",
        "--card-foreground": "#17140f",
        "--popover": "#fffdf8",
        "--popover-foreground": "#17140f",
        "--primary": "#17140f",
        "--primary-foreground": "#f7f2e9",
        "--secondary": "#e9dfd0",
        "--secondary-foreground": "#332c22",
        "--muted": "#efe8db",
        "--muted-foreground": "#5c5346",
        "--accent": "#8c3b2e",
        "--accent-foreground": "#fbf7f0",
        "--destructive": "#9b2c22",
        "--destructive-foreground": "#fbf7f0",
        "--border": "#ded3c2",
        "--input": "#ded3c2",
        "--ring": "#8c3b2e",
        "--link": "#8c3b2e",
        "--success": "#3f6444",
        "--warning": "#7a5714",
        "--chart-1": "#8c3b2e",
        "--chart-2": "#3f6444",
        "--chart-3": "#7a5714",
        "--chart-4": "#5c5346",
        "--chart-5": "#17140f",
        "--shadow-card": "inset 0 0 0 1px #17140f14",
        "--shadow-float": "inset 0 0 0 1px #17140f14, 0 10px 18px -8px #17140f1f",
        "--shadow-modal": "inset 0 0 0 1px #17140f1a, 0 12px 20px -6px #17140f1f, 0 28px 44px -12px #17140f29"
      }
    },
    "dark": {
      "tokens": {
        "--radius": "0.125rem",
        "--background": "#14110d",
        "--foreground": "#f2eadc",
        "--card": "#1c1813",
        "--card-foreground": "#f2eadc",
        "--popover": "#1f1a15",
        "--popover-foreground": "#f2eadc",
        "--primary": "#f2eadc",
        "--primary-foreground": "#14110d",
        "--secondary": "#2b241c",
        "--secondary-foreground": "#e8dfd0",
        "--muted": "#241f18",
        "--muted-foreground": "#b0a390",
        "--accent": "#e0907a",
        "--accent-foreground": "#14110d",
        "--destructive": "#e8806e",
        "--destructive-foreground": "#14110d",
        "--border": "#3a3128",
        "--input": "#3a3128",
        "--ring": "#e0907a",
        "--link": "#e6a48f",
        "--success": "#7fb083",
        "--warning": "#d7ae63",
        "--chart-1": "#e0907a",
        "--chart-2": "#7fb083",
        "--chart-3": "#d7ae63",
        "--chart-4": "#b0a390",
        "--chart-5": "#f2eadc",
        "--shadow-card": "inset 0 0 0 1px #ffffff12",
        "--shadow-float": "inset 0 0 0 1px #ffffff12, 0 10px 18px -8px #00000066",
        "--shadow-modal": "inset 0 0 0 1px #ffffff1a, 0 12px 20px -6px #00000073, 0 28px 44px -12px #00000080"
      }
    }
  }
}
